{
  "schema": "vibeic.ppa.timing_rows.v1",
  "program": "_ppa.timing",
  "project": "/home/reyerchu/_jxlayer/run/trials/p08",
  "row_count": 56,
  "measured_count": 52,
  "not_measured_count": 4,
  "invalid_count": 0,
  "notes": [
    "opened 6 STA artefact(s): phase3/stage3/sta/sta_mcorner_ocv.rpt, phase3/stage3/sta/sta_spef_based.rpt, phase3/stage3/sta/sta_spef_multicorner.rpt, reports/phase3/sta_mcorner_ocv.rpt, reports/phase3/sta_spef_based.rpt, reports/phase3/sta_spef_multicorner.rpt"
  ],
  "rows": [
    {
      "schema": "vibeic.ppa.metric.v1",
      "metric": "timing.setup.worst_slack_ns",
      "status": "MEASURED",
      "value": 3.57,
      "unit": "ns",
      "scope": {
        "stage": "post_route_extracted",
        "mode": "functional",
        "process": "ss",
        "voltage_v": 1.6,
        "temperature_c": 100.0,
        "rc_corner": null,
        "clock": null,
        "check": "setup"
      },
      "scope_gaps": {
        "rc_corner": "this report names no RC corner for the section; the RC axis is reported by the multi-corner SPEF report, not this one"
      },
      "source": {
        "path": "phase3/stage3/sta/sta_mcorner_ocv.rpt",
        "sha256": "sha256:56692098d113fd6298ace2a0413f820c5375c1a6562e096890b3da6c9b9d935d",
        "tool": "opensta",
        "tool_commit": null,
        "parser": "_ppa/backends/opensta.py",
        "parser_sha256": "sha256:054a956d923c110d53b6fd56503d7c25440493963f405eabb7aa31e938db64b1",
        "line": 5,
        "raw": "worst slack max 3.57"
      }
    },
    {
      "schema": "vibeic.ppa.metric.v1",
      "metric": "timing.setup.wns_ns",
      "status": "MEASURED",
      "value": 0.0,
      "unit": "ns",
      "scope": {
        "stage": "post_route_extracted",
        "mode": "functional",
        "process": "ss",
        "voltage_v": 1.6,
        "temperature_c": 100.0,
        "rc_corner": null,
        "clock": null,
        "check": "setup"
      },
      "scope_gaps": {
        "rc_corner": "this report names no RC corner for the section; the RC axis is reported by the multi-corner SPEF report, not this one"
      },
      "source": {
        "path": "phase3/stage3/sta/sta_mcorner_ocv.rpt",
        "sha256": "sha256:56692098d113fd6298ace2a0413f820c5375c1a6562e096890b3da6c9b9d935d",
        "tool": "opensta",
        "tool_commit": null,
        "parser": "_ppa/backends/opensta.py",
        "parser_sha256": "sha256:054a956d923c110d53b6fd56503d7c25440493963f405eabb7aa31e938db64b1",
        "line": 7,
        "raw": "wns max 0.00"
      }
    },
    {
      "schema": "vibeic.ppa.metric.v1",
      "metric": "timing.setup.tns_ns",
      "status": "MEASURED",
      "value": 0.0,
      "unit": "ns",
      "scope": {
        "stage": "post_route_extracted",
        "mode": "functional",
        "process": "ss",
        "voltage_v": 1.6,
        "temperature_c": 100.0,
        "rc_corner": null,
        "clock": null,
        "check": "setup"
      },
      "scope_gaps": {
        "rc_corner": "this report names no RC corner for the section; the RC axis is reported by the multi-corner SPEF report, not this one"
      },
      "source": {
        "path": "phase3/stage3/sta/sta_mcorner_ocv.rpt",
        "sha256": "sha256:56692098d113fd6298ace2a0413f820c5375c1a6562e096890b3da6c9b9d935d",
        "tool": "opensta",
        "tool_commit": null,
        "parser": "_ppa/backends/opensta.py",
        "parser_sha256": "sha256:054a956d923c110d53b6fd56503d7c25440493963f405eabb7aa31e938db64b1",
        "line": 6,
        "raw": "tns max 0.00"
      }
    },
    {
      "schema": "vibeic.ppa.metric.v1",
      "metric": "timing.setup.worst_path_slack_ns",
      "status": "MEASURED",
      "value": 3.57,
      "unit": "ns",
      "scope": {
        "stage": "post_route_extracted",
        "mode": "functional",
        "process": "ss",
        "voltage_v": 1.6,
        "temperature_c": 100.0,
        "rc_corner": null,
        "clock": "clk",
        "check": "setup"
      },
      "scope_gaps": {
        "rc_corner": "this report names no RC corner for the section; the RC axis is reported by the multi-corner SPEF report, not this one"
      },
      "source": {
        "path": "phase3/stage3/sta/sta_mcorner_ocv.rpt",
        "sha256": "sha256:56692098d113fd6298ace2a0413f820c5375c1a6562e096890b3da6c9b9d935d",
        "tool": "opensta",
        "tool_commit": null,
        "parser": "_ppa/backends/opensta.py",
        "parser_sha256": "sha256:054a956d923c110d53b6fd56503d7c25440493963f405eabb7aa31e938db64b1",
        "line": 9,
        "raw": "Startpoint: __uuf__._476_ (rising edge-triggered flip-flop clocked by clk)"
      }
    },
    {
      "schema": "vibeic.ppa.metric.v1",
      "metric": "timing.setup.worst_path_slack_ns",
      "status": "MEASURED",
      "value": 3.66,
      "unit": "ns",
      "scope": {
        "stage": "post_route_extracted",
        "mode": "functional",
        "process": "ss",
        "voltage_v": 1.6,
        "temperature_c": 100.0,
        "rc_corner": null,
        "clock": "clk",
        "check": "setup"
      },
      "scope_gaps": {
        "rc_corner": "this report names no RC corner for the section; the RC axis is reported by the multi-corner SPEF report, not this one"
      },
      "source": {
        "path": "phase3/stage3/sta/sta_mcorner_ocv.rpt",
        "sha256": "sha256:56692098d113fd6298ace2a0413f820c5375c1a6562e096890b3da6c9b9d935d",
        "tool": "opensta",
        "tool_commit": null,
        "parser": "_ppa/backends/opensta.py",
        "parser_sha256": "sha256:054a956d923c110d53b6fd56503d7c25440493963f405eabb7aa31e938db64b1",
        "line": 44,
        "raw": "Startpoint: __uuf__._476_ (rising edge-triggered flip-flop clocked by clk)"
      }
    },
    {
      "schema": "vibeic.ppa.metric.v1",
      "metric": "timing.setup.worst_path_slack_ns",
      "status": "MEASURED",
      "value": 3.72,
      "unit": "ns",
      "scope": {
        "stage": "post_route_extracted",
        "mode": "functional",
        "process": "ss",
        "voltage_v": 1.6,
        "temperature_c": 100.0,
        "rc_corner": null,
        "clock": "clk",
        "check": "setup"
      },
      "scope_gaps": {
        "rc_corner": "this report names no RC corner for the section; the RC axis is reported by the multi-corner SPEF report, not this one"
      },
      "source": {
        "path": "phase3/stage3/sta/sta_mcorner_ocv.rpt",
        "sha256": "sha256:56692098d113fd6298ace2a0413f820c5375c1a6562e096890b3da6c9b9d935d",
        "tool": "opensta",
        "tool_commit": null,
        "parser": "_ppa/backends/opensta.py",
        "parser_sha256": "sha256:054a956d923c110d53b6fd56503d7c25440493963f405eabb7aa31e938db64b1",
        "line": 79,
        "raw": "Startpoint: __uuf__._476_ (rising edge-triggered flip-flop clocked by clk)"
      }
    },
    {
      "schema": "vibeic.ppa.metric.v1",
      "metric": "timing.hold.worst_slack_ns",
      "status": "MEASURED",
      "value": 0.31,
      "unit": "ns",
      "scope": {
        "stage": "post_route_extracted",
        "mode": "functional",
        "process": "ff",
        "voltage_v": 1.95,
        "temperature_c": -40.0,
        "rc_corner": null,
        "clock": null,
        "check": "hold"
      },
      "scope_gaps": {
        "rc_corner": "this report names no RC corner for the section; the RC axis is reported by the multi-corner SPEF report, not this one"
      },
      "source": {
        "path": "phase3/stage3/sta/sta_mcorner_ocv.rpt",
        "sha256": "sha256:56692098d113fd6298ace2a0413f820c5375c1a6562e096890b3da6c9b9d935d",
        "tool": "opensta",
        "tool_commit": null,
        "parser": "_ppa/backends/opensta.py",
        "parser_sha256": "sha256:054a956d923c110d53b6fd56503d7c25440493963f405eabb7aa31e938db64b1",
        "line": 125,
        "raw": "worst slack min 0.31"
      }
    },
    {
      "schema": "vibeic.ppa.metric.v1",
      "metric": "timing.hold.wns_ns",
      "status": "MEASURED",
      "value": 0.0,
      "unit": "ns",
      "scope": {
        "stage": "post_route_extracted",
        "mode": "functional",
        "process": "ff",
        "voltage_v": 1.95,
        "temperature_c": -40.0,
        "rc_corner": null,
        "clock": null,
        "check": "hold"
      },
      "scope_gaps": {
        "rc_corner": "this report names no RC corner for the section; the RC axis is reported by the multi-corner SPEF report, not this one"
      },
      "source": {
        "path": "phase3/stage3/sta/sta_mcorner_ocv.rpt",
        "sha256": "sha256:56692098d113fd6298ace2a0413f820c5375c1a6562e096890b3da6c9b9d935d",
        "tool": "opensta",
        "tool_commit": null,
        "parser": "_ppa/backends/opensta.py",
        "parser_sha256": "sha256:054a956d923c110d53b6fd56503d7c25440493963f405eabb7aa31e938db64b1",
        "line": 127,
        "raw": "wns min 0.00"
      }
    },
    {
      "schema": "vibeic.ppa.metric.v1",
      "metric": "timing.hold.tns_ns",
      "status": "NOT_MEASURED",
      "reason": "not_reported: the artefact carries no tns line for this view — the tool was not asked, or the query failed",
      "unit": "ns",
      "scope": {
        "stage": "post_route_extracted",
        "mode": "functional",
        "process": "ff",
        "voltage_v": 1.95,
        "temperature_c": -40.0,
        "rc_corner": null,
        "clock": null,
        "check": "hold"
      },
      "scope_gaps": {
        "rc_corner": "this report names no RC corner for the section; the RC axis is reported by the multi-corner SPEF report, not this one"
      },
      "source": {
        "path": "phase3/stage3/sta/sta_mcorner_ocv.rpt",
        "sha256": "sha256:56692098d113fd6298ace2a0413f820c5375c1a6562e096890b3da6c9b9d935d",
        "tool": "opensta",
        "tool_commit": null,
        "parser": "_ppa/backends/opensta.py",
        "parser_sha256": "sha256:054a956d923c110d53b6fd56503d7c25440493963f405eabb7aa31e938db64b1",
        "line": null,
        "raw": null